<?xml version="1.0" encoding="UTF-8"?>
<scores xmlns:xsi="http://www.w3.org/2001/XMLSchema-instance" xsi:noNamespaceSchemaLocation="output.xsd">
	
			<score>
				<place>1</place>
				<name>Peeter Tomberg</name>
				<dob>18.06.1988</dob>
				<iso>ee</iso>
				<points>9990</points>
				<scoreData>[10.395, 7.76, 18.4, 2.2, 46.17, 13.8, 56.17, 5.28, 77.19, 233.79]</scoreData>
			</score>
			
		
</scores>